{
  "manifest_version": "release-integrity-v1",
  "release_id": "cystic-fibrosis-top120-v0.1.1-preview",
  "release_generated_at": "2026-06-14T00:00:00Z",
  "release_status": "draft",
  "schema_version": "0.1.0",
  "digest_algorithm": "sha256",
  "canonical_path_root": "repository-root",
  "file_count": 37,
  "archive_count": 1,
  "files": [
    {
      "path": "CITATION.cff",
      "bytes": 428,
      "sha256": "8b77a34baa74d34752760631e884d273d530c47901126430109d2f83ca0f56dd"
    },
    {
      "path": "LICENSE",
      "bytes": 3683,
      "sha256": "91000916ab34ed44df34c6e284dee8288fbd0853e90d26d7efec8ff481c9ec37"
    },
    {
      "path": "README.md",
      "bytes": 3297,
      "sha256": "1c0891b73eef2535532c68ca2ddf623d73468a402a7f1327d453d548ed5595f6"
    },
    {
      "path": "data/source_snapshots/clinvar-gene-condition-cystic-fibrosis-paper120-2026-06-14/manifest.json",
      "bytes": 577,
      "sha256": "ce048dcd359390697e0ce0624fc6d8f9b22de8d1038dba2ab401a57d5bce16cc"
    },
    {
      "path": "data/source_snapshots/clinvar-gene-condition-cystic-fibrosis-paper120-2026-06-14/records.jsonl",
      "bytes": 618,
      "sha256": "ecb1325ff27238681027a1eb4ae94cedde3805a02b02b544f8585c3e6221e28a"
    },
    {
      "path": "data/source_snapshots/opentargets-cystic-fibrosis-associated-targets-2026-06-14-paper120/manifest.json",
      "bytes": 621,
      "sha256": "a058c56f5fd9fbe76a5c0502381c27e3eea553784f61b5f3d1eb1df09ee8a92b"
    },
    {
      "path": "data/source_snapshots/opentargets-cystic-fibrosis-associated-targets-2026-06-14-paper120/records.jsonl",
      "bytes": 46009,
      "sha256": "1968693dc52596707adee4cec030388254b1ff9d897be550035f45726a0d96c9"
    },
    {
      "path": "docs/data-dictionary.md",
      "bytes": 11233,
      "sha256": "beb6acc136d0e94cfd00cf6ffa98464e7659f64153edfe4db31e8fee51d8d71d"
    },
    {
      "path": "docs/release-policy.md",
      "bytes": 1287,
      "sha256": "64966dc606df72f562d0292f990ef29a6f658bd151738f076d1bbcf130b7a1e1"
    },
    {
      "path": "releases/cystic-fibrosis-top120-v0.1.1-preview/README.md",
      "bytes": 529,
      "sha256": "ce460081b7ab8e3e2cacd469511fe59df0e1e55e56e092b7fa32bb32fd783114"
    },
    {
      "path": "releases/cystic-fibrosis-top120-v0.1.1-preview/associations.json",
      "bytes": 135977,
      "sha256": "6cdd94c18144aed0824cf6a609f5fc16ac85e9feeab5d9a99da23db8361d80f5"
    },
    {
      "path": "releases/cystic-fibrosis-top120-v0.1.1-preview/changelog.json",
      "bytes": 1542,
      "sha256": "c958ead21a69123f1c2d0dcd030017a72ee70882a5bb74d1dd0da7a78473378f"
    },
    {
      "path": "releases/cystic-fibrosis-top120-v0.1.1-preview/diseases.json",
      "bytes": 144,
      "sha256": "4f1a971010388e6c1787b6d14b816346a7a9d842be25cd2a356f37d9f6325830"
    },
    {
      "path": "releases/cystic-fibrosis-top120-v0.1.1-preview/evidence_rows.jsonl",
      "bytes": 94561,
      "sha256": "eca655952e52ce26143bc651f08de5c06a7395fd13d121c9cc385bf26dd10659"
    },
    {
      "path": "releases/cystic-fibrosis-top120-v0.1.1-preview/genes.json",
      "bytes": 23714,
      "sha256": "1e2fb1248a63b48b0acc0734af1477f865b0a767fc53778302ebeb9606192beb"
    },
    {
      "path": "releases/cystic-fibrosis-top120-v0.1.1-preview/release.json",
      "bytes": 593,
      "sha256": "3cca029230ca4ab19204130e43e5bdc3010960bce3aff816aa25afa454a29f87"
    },
    {
      "path": "releases/cystic-fibrosis-top120-v0.1.1-preview/review_artifacts.jsonl",
      "bytes": 139448,
      "sha256": "b5cb811e220343fbe3dbfbc4350a4d0db79b1eb284ca2ab1abd3323d9f48b1e0"
    },
    {
      "path": "releases/cystic-fibrosis-top120-v0.1.1-preview/source_snapshots.json",
      "bytes": 2049,
      "sha256": "a0ff1011cd13b8a53dc36d905aaa3c18a78bd1baa34ddf9e33677b95498bc326"
    },
    {
      "path": "releases/cystic-fibrosis-top120-v0.1.1-preview/sources.json",
      "bytes": 6901,
      "sha256": "aa0e8724f7636e1fae053ea2c1708d08fe522a086415cf6a79b8b92fae3908e8"
    },
    {
      "path": "schemas/README.md",
      "bytes": 825,
      "sha256": "d306274cb3d33c16d681f4748095a391e3a1c5f863bc001480756c04167770ba"
    },
    {
      "path": "schemas/association.schema.json",
      "bytes": 1802,
      "sha256": "5d67accffeca5996ae4265c4ce473396cb1f7189401ed0c99b0325c2a83143e0"
    },
    {
      "path": "schemas/disease.schema.json",
      "bytes": 516,
      "sha256": "c2777ed7e39cd3b10ac2b193361f7c27d74a65ba90788fc5626d2ebf87ad9d27"
    },
    {
      "path": "schemas/evidence-row.schema.json",
      "bytes": 1938,
      "sha256": "afd8566aa0a1a370f434808fd4e23af8a20c0742f4cd393f28023fde569beee7"
    },
    {
      "path": "schemas/gene.schema.json",
      "bytes": 554,
      "sha256": "ebd61d1549edb2d307526667feafeb0aa0f10db65ce6afabb2638330bc012b09"
    },
    {
      "path": "schemas/manifest.json",
      "bytes": 4736,
      "sha256": "7520de98c03c1c77fbfc02f4e633bdd15c09962232f7ad54bf1864303a5d3db3"
    },
    {
      "path": "schemas/public-export-gate-decision.schema.json",
      "bytes": 1626,
      "sha256": "8945fb7a00247b5f18eac4836b7192cf30584e65ab8cfd4b4e7c79d74ad86ab1"
    },
    {
      "path": "schemas/public-export-gate.schema.json",
      "bytes": 5704,
      "sha256": "d3d8ca0bce8ab8f70939c8c4719f4a3e57817266be2604124e3e6b979316eb85"
    },
    {
      "path": "schemas/public-source-gate-decision.schema.json",
      "bytes": 1686,
      "sha256": "4b331d60eb003dff2c9a3e566b90a6822f3c5e83f54b85a0e3fd1baf30cd0f00"
    },
    {
      "path": "schemas/public-source-gate.schema.json",
      "bytes": 7186,
      "sha256": "77ce9d3ca75c9544e0eccea770695632164b8bbeb7693a595189f218446a5be4"
    },
    {
      "path": "schemas/release-candidate-checklist.schema.json",
      "bytes": 4636,
      "sha256": "c3e8488117eea77d1e46ab1545ae6df0ac68b828ece2f2a0cb6ea2f5fd39c9da"
    },
    {
      "path": "schemas/release-integrity.schema.json",
      "bytes": 1524,
      "sha256": "4d084f2d40f704c747e6e7492d1203788d6d07efd4fb686b6c07890021e19b44"
    },
    {
      "path": "schemas/release.schema.json",
      "bytes": 679,
      "sha256": "4a41ba490d8c95112e4ad559e7baaa74045fa64e8bfa0ad78e8c1aaefd6a1c7a"
    },
    {
      "path": "schemas/review-artifact.schema.json",
      "bytes": 892,
      "sha256": "14a378d8233f10dc5824a505ec2e6232e8d96dcd2dbcbc81a4bdb49b828e2cd6"
    },
    {
      "path": "schemas/review-decision.schema.json",
      "bytes": 1715,
      "sha256": "ac4d6251cdee54fba059360a4b26cb50a9b8875d202f3992553fb0a9cd4e667d"
    },
    {
      "path": "schemas/source-recheck.schema.json",
      "bytes": 6547,
      "sha256": "a258e70d38c194387297820b7727bef6d26119c66541c6732af1cc6195fc15f1"
    },
    {
      "path": "schemas/source-snapshot.schema.json",
      "bytes": 1340,
      "sha256": "b6c9a1ba6045c5d6ccd61eecd0b735a36bba1f39f0983dff8e4e5a471c9e7ef9"
    },
    {
      "path": "schemas/source.schema.json",
      "bytes": 2378,
      "sha256": "95e713c81cfb67241a03eb85323c22546c63afb83e96a72b4c41fb2250a10777"
    }
  ],
  "archives": [
    {
      "path": "archives/gene-disease-evidence-cystic-fibrosis-top120-v0.1.1-preview.zip",
      "bytes": 56645,
      "sha256": "1f0d7e00b55632ac4c70c17a5e659fb2bf93b940e66322e3927a4027b3babc9f"
    }
  ]
}
