{
  "manifest_version": "release-integrity-v1",
  "release_id": "parkinson-top120-v0.1.0-preview",
  "release_generated_at": "2026-06-14T00:00:00Z",
  "release_status": "draft",
  "schema_version": "0.1.0",
  "digest_algorithm": "sha256",
  "canonical_path_root": "repository-root",
  "file_count": 37,
  "archive_count": 1,
  "files": [
    {
      "path": "CITATION.cff",
      "bytes": 428,
      "sha256": "8b77a34baa74d34752760631e884d273d530c47901126430109d2f83ca0f56dd"
    },
    {
      "path": "LICENSE",
      "bytes": 3683,
      "sha256": "91000916ab34ed44df34c6e284dee8288fbd0853e90d26d7efec8ff481c9ec37"
    },
    {
      "path": "README.md",
      "bytes": 2680,
      "sha256": "24a1eb0ac6b70541c4c2459052181fd1fc0bea3c96de427e5c6406407436277c"
    },
    {
      "path": "data/source_snapshots/snapshot%3Aclinvar%3Agene-condition%3Aparkinson-paper120%3A2026-06-14/manifest.json",
      "bytes": 568,
      "sha256": "2018220818894c90ee433895c7096180b60dd18d5b79bed1c4b2684c9e162eb8"
    },
    {
      "path": "data/source_snapshots/snapshot%3Aclinvar%3Agene-condition%3Aparkinson-paper120%3A2026-06-14/records.jsonl",
      "bytes": 3684,
      "sha256": "aa811cdabadf1972ac577419c22952b65e83cceeed18636b2f97ba0e3270d546"
    },
    {
      "path": "data/source_snapshots/snapshot%3Aopentargets%3Aparkinson-associated-targets%3A2026-06-14%3Apaper120/manifest.json",
      "bytes": 611,
      "sha256": "9c1a94e197182380a192b6bc986d28170429d349e089933b2b6a903290fb7339"
    },
    {
      "path": "data/source_snapshots/snapshot%3Aopentargets%3Aparkinson-associated-targets%3A2026-06-14%3Apaper120/records.jsonl",
      "bytes": 61954,
      "sha256": "c08e05dc364137de07d862adfd437a660b55fa1680f51d4c16a75cd31afea9d6"
    },
    {
      "path": "docs/data-dictionary.md",
      "bytes": 11233,
      "sha256": "beb6acc136d0e94cfd00cf6ffa98464e7659f64153edfe4db31e8fee51d8d71d"
    },
    {
      "path": "docs/release-policy.md",
      "bytes": 1287,
      "sha256": "64966dc606df72f562d0292f990ef29a6f658bd151738f076d1bbcf130b7a1e1"
    },
    {
      "path": "releases/parkinson-top120-v0.1.0-preview/README.md",
      "bytes": 523,
      "sha256": "c5d4872b9083d214ce94e1524e21046b80e6b0d3998fa868e9dc6263074d0d89"
    },
    {
      "path": "releases/parkinson-top120-v0.1.0-preview/associations.json",
      "bytes": 137347,
      "sha256": "aca60df7423d8d136b6f72d7503df31e9138d78ec02ac72ece0f14ccb81e0f98"
    },
    {
      "path": "releases/parkinson-top120-v0.1.0-preview/changelog.json",
      "bytes": 1501,
      "sha256": "9deb49dd7a96b08fac5cc7b4f4ce0473e70cfabd660a0cf2dfbf0a98739906c4"
    },
    {
      "path": "releases/parkinson-top120-v0.1.0-preview/diseases.json",
      "bytes": 146,
      "sha256": "6216af0c4e6af4140b5d81a0eee30778ac9350b463322d1a1a367091ddb3d15a"
    },
    {
      "path": "releases/parkinson-top120-v0.1.0-preview/evidence_rows.jsonl",
      "bytes": 113721,
      "sha256": "f14506d526158f39f024f66b83b7aa249e2e3e1f49f279430c63120cd0bb2a08"
    },
    {
      "path": "releases/parkinson-top120-v0.1.0-preview/genes.json",
      "bytes": 25892,
      "sha256": "16740634b3d1e457e9bf7b7a23f9bb534146daf32c76701a2ba34d2af35c43d7"
    },
    {
      "path": "releases/parkinson-top120-v0.1.0-preview/release.json",
      "bytes": 587,
      "sha256": "be32d4c5b42de86eb6e8a1ac4d5c138efb3555d7eeaaf916cab1ec3358c27b4c"
    },
    {
      "path": "releases/parkinson-top120-v0.1.0-preview/review_artifacts.jsonl",
      "bytes": 138688,
      "sha256": "c9ea57721ac2dcc2a361013ed81e630298fef1d09feb81427c642c3335256568"
    },
    {
      "path": "releases/parkinson-top120-v0.1.0-preview/source_snapshots.json",
      "bytes": 2064,
      "sha256": "83cf19b6f4d6ad2152414eda2f0f72588e0ba64a8f4d51f42f592bb532104449"
    },
    {
      "path": "releases/parkinson-top120-v0.1.0-preview/sources.json",
      "bytes": 6895,
      "sha256": "f2f279b85493c032bf3da263bdfcd716c398388dc6a67ef8fa44ff6fbe28982d"
    },
    {
      "path": "schemas/README.md",
      "bytes": 825,
      "sha256": "d306274cb3d33c16d681f4748095a391e3a1c5f863bc001480756c04167770ba"
    },
    {
      "path": "schemas/association.schema.json",
      "bytes": 1802,
      "sha256": "5d67accffeca5996ae4265c4ce473396cb1f7189401ed0c99b0325c2a83143e0"
    },
    {
      "path": "schemas/disease.schema.json",
      "bytes": 516,
      "sha256": "c2777ed7e39cd3b10ac2b193361f7c27d74a65ba90788fc5626d2ebf87ad9d27"
    },
    {
      "path": "schemas/evidence-row.schema.json",
      "bytes": 1938,
      "sha256": "afd8566aa0a1a370f434808fd4e23af8a20c0742f4cd393f28023fde569beee7"
    },
    {
      "path": "schemas/gene.schema.json",
      "bytes": 554,
      "sha256": "ebd61d1549edb2d307526667feafeb0aa0f10db65ce6afabb2638330bc012b09"
    },
    {
      "path": "schemas/manifest.json",
      "bytes": 4736,
      "sha256": "7520de98c03c1c77fbfc02f4e633bdd15c09962232f7ad54bf1864303a5d3db3"
    },
    {
      "path": "schemas/public-export-gate-decision.schema.json",
      "bytes": 1626,
      "sha256": "8945fb7a00247b5f18eac4836b7192cf30584e65ab8cfd4b4e7c79d74ad86ab1"
    },
    {
      "path": "schemas/public-export-gate.schema.json",
      "bytes": 5704,
      "sha256": "d3d8ca0bce8ab8f70939c8c4719f4a3e57817266be2604124e3e6b979316eb85"
    },
    {
      "path": "schemas/public-source-gate-decision.schema.json",
      "bytes": 1686,
      "sha256": "4b331d60eb003dff2c9a3e566b90a6822f3c5e83f54b85a0e3fd1baf30cd0f00"
    },
    {
      "path": "schemas/public-source-gate.schema.json",
      "bytes": 7186,
      "sha256": "77ce9d3ca75c9544e0eccea770695632164b8bbeb7693a595189f218446a5be4"
    },
    {
      "path": "schemas/release-candidate-checklist.schema.json",
      "bytes": 4636,
      "sha256": "c3e8488117eea77d1e46ab1545ae6df0ac68b828ece2f2a0cb6ea2f5fd39c9da"
    },
    {
      "path": "schemas/release-integrity.schema.json",
      "bytes": 1524,
      "sha256": "4d084f2d40f704c747e6e7492d1203788d6d07efd4fb686b6c07890021e19b44"
    },
    {
      "path": "schemas/release.schema.json",
      "bytes": 679,
      "sha256": "4a41ba490d8c95112e4ad559e7baaa74045fa64e8bfa0ad78e8c1aaefd6a1c7a"
    },
    {
      "path": "schemas/review-artifact.schema.json",
      "bytes": 892,
      "sha256": "14a378d8233f10dc5824a505ec2e6232e8d96dcd2dbcbc81a4bdb49b828e2cd6"
    },
    {
      "path": "schemas/review-decision.schema.json",
      "bytes": 1715,
      "sha256": "ac4d6251cdee54fba059360a4b26cb50a9b8875d202f3992553fb0a9cd4e667d"
    },
    {
      "path": "schemas/source-recheck.schema.json",
      "bytes": 6547,
      "sha256": "a258e70d38c194387297820b7727bef6d26119c66541c6732af1cc6195fc15f1"
    },
    {
      "path": "schemas/source-snapshot.schema.json",
      "bytes": 1340,
      "sha256": "b6c9a1ba6045c5d6ccd61eecd0b735a36bba1f39f0983dff8e4e5a471c9e7ef9"
    },
    {
      "path": "schemas/source.schema.json",
      "bytes": 2378,
      "sha256": "95e713c81cfb67241a03eb85323c22546c63afb83e96a72b4c41fb2250a10777"
    }
  ],
  "archives": [
    {
      "path": "archives/gene-disease-evidence-parkinson-top120-v0.1.0-preview.zip",
      "bytes": 68122,
      "sha256": "636142c9693a7caf025087fd521722dd73b84f9504d530b414e8840df245333d"
    }
  ]
}
