{
  "manifest_version": "release-integrity-v1",
  "release_id": "parkinson-v0.1.0",
  "release_generated_at": "2026-06-10T00:00:00Z",
  "release_status": "draft",
  "schema_version": "0.1.0",
  "digest_algorithm": "sha256",
  "canonical_path_root": "repository-root",
  "file_count": 31,
  "archive_count": 1,
  "files": [
    {
      "path": "CITATION.cff",
      "bytes": 428,
      "sha256": "8b77a34baa74d34752760631e884d273d530c47901126430109d2f83ca0f56dd"
    },
    {
      "path": "LICENSE",
      "bytes": 3683,
      "sha256": "91000916ab34ed44df34c6e284dee8288fbd0853e90d26d7efec8ff481c9ec37"
    },
    {
      "path": "README.md",
      "bytes": 2090,
      "sha256": "7cfef3a940493b7fec05156a2496606d16ba5baf657804f8065ac3c945dbe392"
    },
    {
      "path": "data/source_snapshots/snapshot%3Aclinvar%3Agene-condition%3Aparkinson-mondo-0005180%3A2026-06-10/manifest.json",
      "bytes": 553,
      "sha256": "4127a95b3761ec174312fd586e75979dcea811b52a373cbad40ce7bb7f05db42"
    },
    {
      "path": "data/source_snapshots/snapshot%3Aclinvar%3Agene-condition%3Aparkinson-mondo-0005180%3A2026-06-10/records.jsonl",
      "bytes": 1838,
      "sha256": "ffc7767ef2a6bf2fa11f5a97dac61d4651e833389765796f05ef2fb81587ebd8"
    },
    {
      "path": "data/source_snapshots/snapshot%3Aopentargets%3Aparkinson-associated-targets%3A2026-06-10%3Adev/manifest.json",
      "bytes": 550,
      "sha256": "19249327af4f8745e64fad9f3966e5ad0e34f4310f13d4fbe467d781a93a98a2"
    },
    {
      "path": "data/source_snapshots/snapshot%3Aopentargets%3Aparkinson-associated-targets%3A2026-06-10%3Adev/records.jsonl",
      "bytes": 4927,
      "sha256": "85319159e4bd693031bca7332d72a34286b34e7bc07ca6a714f1ce9ce04b37cc"
    },
    {
      "path": "docs/data-dictionary.md",
      "bytes": 6729,
      "sha256": "ef73a173c402d264c2d2c4cf7b940929ab9050abbd2080e41fac2df35b783fc0"
    },
    {
      "path": "docs/release-policy.md",
      "bytes": 922,
      "sha256": "6d924ffb25be65c25c47184af7fe3f75dc24acd1929c0db5cc203759d0ff754c"
    },
    {
      "path": "releases/parkinson-v0.1.0/README.md",
      "bytes": 1802,
      "sha256": "56ee6a062bb6a3380356051bf2d78052fdbb4d92ce81fad0a05d3e5853366700"
    },
    {
      "path": "releases/parkinson-v0.1.0/associations.json",
      "bytes": 6935,
      "sha256": "66fbe278fde09016b62b48078af849bb1b91b8027def3f6a108e070f17679b24"
    },
    {
      "path": "releases/parkinson-v0.1.0/changelog.json",
      "bytes": 1890,
      "sha256": "22afbfcb989a0be0c83ed39532b17f75c15d6f39ebfc318060fae65451302aef"
    },
    {
      "path": "releases/parkinson-v0.1.0/diseases.json",
      "bytes": 179,
      "sha256": "6571df6498913b507932974548f0d8087df33393c32c7b1dd1ecbb9b85adeed3"
    },
    {
      "path": "releases/parkinson-v0.1.0/evidence_rows.jsonl",
      "bytes": 10455,
      "sha256": "8bf14dea156439931b74eb7b5085a2e8e88faac26c8605dda561e06c4f29c200"
    },
    {
      "path": "releases/parkinson-v0.1.0/genes.json",
      "bytes": 1658,
      "sha256": "5475da1d0a8597f0833768c24a4b3961e091f69e706448bdab9748543df65c77"
    },
    {
      "path": "releases/parkinson-v0.1.0/release.json",
      "bytes": 870,
      "sha256": "b633579706aa15e05d1f9bb8ea23e43e1ed6d29dee995848b8dac235782fc341"
    },
    {
      "path": "releases/parkinson-v0.1.0/review_artifacts.jsonl",
      "bytes": 6824,
      "sha256": "1f8c2492fd7bff98afb000193645454e18b6aa4e90613a9745f5622193614b12"
    },
    {
      "path": "releases/parkinson-v0.1.0/source_snapshots.json",
      "bytes": 1988,
      "sha256": "3ee318b61b9562e36aba9bfa6b1f9661665570390915732db2069f5659906acd"
    },
    {
      "path": "releases/parkinson-v0.1.0/sources.json",
      "bytes": 6851,
      "sha256": "b63c4e3e1366228e46030b934a8f16ff69e170dad8c7ae6c85c11d0d68f20a09"
    },
    {
      "path": "schemas/association.schema.json",
      "bytes": 1802,
      "sha256": "5d67accffeca5996ae4265c4ce473396cb1f7189401ed0c99b0325c2a83143e0"
    },
    {
      "path": "schemas/disease.schema.json",
      "bytes": 516,
      "sha256": "c2777ed7e39cd3b10ac2b193361f7c27d74a65ba90788fc5626d2ebf87ad9d27"
    },
    {
      "path": "schemas/evidence-row.schema.json",
      "bytes": 1938,
      "sha256": "afd8566aa0a1a370f434808fd4e23af8a20c0742f4cd393f28023fde569beee7"
    },
    {
      "path": "schemas/gene.schema.json",
      "bytes": 554,
      "sha256": "ebd61d1549edb2d307526667feafeb0aa0f10db65ce6afabb2638330bc012b09"
    },
    {
      "path": "schemas/release-candidate-checklist.schema.json",
      "bytes": 4636,
      "sha256": "c3e8488117eea77d1e46ab1545ae6df0ac68b828ece2f2a0cb6ea2f5fd39c9da"
    },
    {
      "path": "schemas/release-integrity.schema.json",
      "bytes": 1524,
      "sha256": "4d084f2d40f704c747e6e7492d1203788d6d07efd4fb686b6c07890021e19b44"
    },
    {
      "path": "schemas/release.schema.json",
      "bytes": 679,
      "sha256": "4a41ba490d8c95112e4ad559e7baaa74045fa64e8bfa0ad78e8c1aaefd6a1c7a"
    },
    {
      "path": "schemas/review-artifact.schema.json",
      "bytes": 892,
      "sha256": "14a378d8233f10dc5824a505ec2e6232e8d96dcd2dbcbc81a4bdb49b828e2cd6"
    },
    {
      "path": "schemas/review-decision.schema.json",
      "bytes": 1715,
      "sha256": "ac4d6251cdee54fba059360a4b26cb50a9b8875d202f3992553fb0a9cd4e667d"
    },
    {
      "path": "schemas/source-recheck.schema.json",
      "bytes": 4504,
      "sha256": "c84e479d4a1c5ac01fc93ff6b0467c53213a1e604692161d01fdd9f618eeae42"
    },
    {
      "path": "schemas/source-snapshot.schema.json",
      "bytes": 1340,
      "sha256": "b6c9a1ba6045c5d6ccd61eecd0b735a36bba1f39f0983dff8e4e5a471c9e7ef9"
    },
    {
      "path": "schemas/source.schema.json",
      "bytes": 2378,
      "sha256": "95e713c81cfb67241a03eb85323c22546c63afb83e96a72b4c41fb2250a10777"
    }
  ],
  "archives": [
    {
      "path": "archives/gene-disease-evidence-parkinson-v0.1.0.zip",
      "bytes": 27125,
      "sha256": "ffffa30cdf35447ae975c12b57d2339d5e79833cbbe8e3bc182998173a0524aa"
    }
  ]
}
